<?xml version="1.0" encoding="UTF-8"?>
<p:manager_adapter_v1 name="" version=""
	xmlns:p="manager_adapter_v1"
	xmlns:xsi="http://www.w3.org/2001/XMLSchema-instance"
	xsi:schemaLocation="manager_adapter_v1 ../../../adapter-lib/src/main/resources/schemas/manager/manager_adapter_v1.xsd ">
	<p:subscriptors>
		<p:subscriptor>
			<p:id>1</p:id>
			<p:enabled>true</p:enabled>
			<p:entity>SendFramesCommand</p:entity>
		</p:subscriptor>

	</p:subscriptors>
	<p:executors>
		<p:executor>
			<p:id>1</p:id>
			<p:enabled>true</p:enabled>
			<p:merge_wait_time>1</p:merge_wait_time>
			<p:manager_class>com.revenga.rits.back.virtual.equipment.manager.une.UneExecutor</p:manager_class>
			<p:subscriptors_ref>
				<p:subscriptor_id_ref>1</p:subscriptor_id_ref>
			</p:subscriptors_ref>
			<p:executor_params>
				<p:executor_param_value>cron_job=last_period_data_task_job;com.revenga.rits.back.virtual.equipment.manager.une.sheduler.RequestFrameJob;0 * * * * ?;0x07</p:executor_param_value>
				<p:executor_param_value>cron_job=get_traffic_infraction;com.revenga.rits.back.virtual.equipment.manager.une.sheduler.GetTrafficInfractionsJob;0 * * * * ?;3;/home/agomez/radar</p:executor_param_value>
				<p:executor_param_value>elementType=99</p:executor_param_value>
			</p:executor_params>
		</p:executor>

	</p:executors>
</p:manager_adapter_v1>
