<?xml version="1.0" encoding="UTF-8"?>
<p:manager_adapter_v1 name="" version=""
	xmlns:p="manager_adapter_v1"
	xmlns:xsi="http://www.w3.org/2001/XMLSchema-instance"
	xsi:schemaLocation="manager_adapter_v1 ../../../adapter-lib/src/main/resources/schemas/manager/manager_adapter_v1.xsd ">
	<p:subscriptors>
		<p:subscriptor>
			<p:id>1</p:id>
			<p:enabled>true</p:enabled>
			<p:entity>SetAlarmsPublishCommand</p:entity>
		</p:subscriptor>
	</p:subscriptors>
	<p:executors>
		<p:executor>
			<p:id>1</p:id>
			<p:enabled>true</p:enabled>
			<p:threads>4</p:threads>
			<p:merge_wait_time>1</p:merge_wait_time>
			<p:manager_class>com.revenga.rits.back.io.external.manager.executor.SendMailAlarmExecutor</p:manager_class>
			<p:subscriptors_ref>
				<p:subscriptor_id_ref>1</p:subscriptor_id_ref>
			</p:subscriptors_ref>
			<p:executor_params>
				<p:executor_param_value>road_file_path=adapters/manager/io-external-manager/roads.properties</p:executor_param_value>
				<p:executor_param_value>translation_file_path=adapters/manager/io-external-manager/i18n.properties</p:executor_param_value>
				<p:executor_param_value>element_file_path=adapters/manager/io-external-manager/elementTypes.properties</p:executor_param_value>
				<p:executor_param_value>recipients_file_path=adapters/manager/io-external-manager/recipients.properties</p:executor_param_value>
				<p:executor_param_value>body_file_path=adapters/manager/io-external-manager/bodyHTML.properties</p:executor_param_value>
				<p:executor_param_value>alarm_levels=2,3,4,5,6</p:executor_param_value>
				<p:executor_param_value>date_format=dd/MM/yyyy - HH:mm:ss</p:executor_param_value>
				<p:executor_param_value>subject=Alarma nivel %level%: %element%</p:executor_param_value>
  			</p:executor_params>
		</p:executor>
	</p:executors>
</p:manager_adapter_v1>