<?xml version="1.0" encoding="UTF-8"?>
<p:manager_adapter_v1 name="" version=""
	xmlns:p="manager_adapter_v1"
	xmlns:xsi="http://www.w3.org/2001/XMLSchema-instance"
	xsi:schemaLocation="manager_adapter_v1 ../../../adapter-lib/src/main/resources/schemas/manager/manager_adapter_v1.xsd ">
	<p:subscriptors>
		<p:subscriptor>
			<p:id>1</p:id>
			<p:enabled>true</p:enabled>
			<p:entity>SetChangeStateTransitCommand</p:entity>
		</p:subscriptor>
		<p:subscriptor>
			<p:id>2</p:id>
			<p:enabled>true</p:enabled>
			<p:entity>SetChangeAssignedUserTransitCommand</p:entity>
		</p:subscriptor>
	</p:subscriptors>
	<p:executors>
  <p:executor>
			<p:id>1</p:id>
			<p:enabled>true</p:enabled>
			<p:merge_wait_time>1</p:merge_wait_time>
			<p:manager_class>com.revenga.rits.back.transit.manager.transit.recovery.une199121.TransitRecoveryUne199121Executor</p:manager_class>
			<p:executor_params>
				<p:executor_param_value>cron_job=TransitRecoveryJob;recoveryUne199121_4Transits;0 * * * * ?;300;secring_Revenga.gpg;BjXId2LO9Wx+4eMIMJQEMNOl9TDp/bhl9RtFe9BkK2M=</p:executor_param_value>
				<p:executor_param_value>elementType=99</p:executor_param_value>
				<p:executor_param_value>elementSubtype=1</p:executor_param_value>
			</p:executor_params>
		</p:executor>
		<p:executor>
			<p:id>2</p:id>
			<p:enabled>true</p:enabled>
			<p:merge_wait_time>1</p:merge_wait_time>
			<p:manager_class>com.revenga.rits.back.transit.manager.transit.persistence.TransitPersistenceExecutor</p:manager_class>
			<p:subscriptors_ref>
				<p:subscriptor_id_ref>1</p:subscriptor_id_ref>
				<p:subscriptor_id_ref>2</p:subscriptor_id_ref>
			</p:subscriptors_ref>
		</p:executor>		
		<p:executor>
			<p:id>3</p:id>
			<p:enabled>true</p:enabled>
			<p:merge_wait_time>1</p:merge_wait_time>
			<p:manager_class>com.revenga.rits.back.transit.manager.cgi.api.multas.CgiApiMultasExecutor</p:manager_class>
			<p:executor_params>
				<p:executor_param_value><![CDATA[cron_expression=0 * * * * ?]]></p:executor_param_value>
			</p:executor_params>	
		</p:executor>
		<p:executor>
			<p:id>4</p:id>
			<p:enabled>true</p:enabled>
			<p:merge_wait_time>1</p:merge_wait_time>
			<p:manager_class>com.revenga.rits.back.transit.manager.transit.persistence.TransitArchiverExecutor</p:manager_class>
			<p:executor_params>
				<p:executor_param_value><![CDATA[cron_expression_archiver=0 * * * * ?]]></p:executor_param_value>
				<p:executor_param_value><![CDATA[default_archive_after_minutes=1]]></p:executor_param_value>
				<p:executor_param_value><![CDATA[max_transits_to_archive=50]]></p:executor_param_value>
			</p:executor_params>	
		</p:executor>
	</p:executors>
</p:manager_adapter_v1>
