<?xml version="1.0" encoding="UTF-8"?>
<p:manager_adapter_v1 name="" version=""
	xmlns:p="manager_adapter_v1"
	xmlns:xsi="http://www.w3.org/2001/XMLSchema-instance"
	xsi:schemaLocation="manager_adapter_v1 ../../../adapter-lib/src/main/resources/schemas/manager/manager_adapter_v1.xsd ">
	<p:subscriptors>
		<p:subscriptor>
			<p:id>1</p:id>
			<p:enabled>true</p:enabled>
			<p:entity>SetFansStartCommand</p:entity>
		</p:subscriptor>
		<p:subscriptor>
			<p:id>2</p:id>
			<p:enabled>true</p:enabled>
			<p:entity>SetFansStopCommand</p:entity>
		</p:subscriptor>
		<p:subscriptor>
			<p:id>3</p:id>
			<p:enabled>true</p:enabled>
			<p:entity>SetFansStartReverseCommand</p:entity>
		</p:subscriptor>
		<p:subscriptor>
			<p:id>4</p:id>
			<p:enabled>true</p:enabled>
			<p:entity>SetVentilationModeCommand</p:entity>
		</p:subscriptor>
		<p:subscriptor>
			<p:id>5</p:id>
			<p:enabled>true</p:enabled>
			<p:entity>SetVentilationRegimeCommand</p:entity>
		</p:subscriptor>
		<p:subscriptor>
			<p:id>6</p:id>
			<p:enabled>true</p:enabled>
			<p:entity>SetAlarmsToVentilationCommand</p:entity>
		</p:subscriptor>
		<p:subscriptor>
			<p:id>7</p:id>
			<p:enabled>true</p:enabled>
			<p:entity>SetElementStatesToVentilationCommand</p:entity>
		</p:subscriptor>
		<p:subscriptor>
			<p:id>8</p:id>
			<p:enabled>true</p:enabled>
			<p:entity>SetElementValuesToVentilationCommand</p:entity>
		</p:subscriptor>
		<p:subscriptor>
			<p:id>9</p:id>
			<p:enabled>true</p:enabled>
			<p:entity>SetFireAlarmCommand</p:entity>
		</p:subscriptor>
		<p:subscriptor>
			<p:id>10</p:id>
			<p:enabled>true</p:enabled>
			<p:entity>SetIlluminationModeCommand</p:entity>
		</p:subscriptor>
		<p:subscriptor>
			<p:id>11</p:id>
			<p:enabled>true</p:enabled>
			<p:entity>SetIlluminationRegimeCommand</p:entity>
		</p:subscriptor>
		<p:subscriptor>
			<p:id>12</p:id>
			<p:enabled>true</p:enabled>
			<p:entity>SetAlarmsToIlluminationCommand</p:entity>
		</p:subscriptor>
		<p:subscriptor>
			<p:id>13</p:id>
			<p:enabled>true</p:enabled>
			<p:entity>SetElementStatesToIlluminationCommand</p:entity>
		</p:subscriptor>
		<p:subscriptor>
			<p:id>14</p:id>
			<p:enabled>true</p:enabled>
			<p:entity>SetElementValuesToIlluminationCommand</p:entity>
		</p:subscriptor>
		<p:subscriptor>
			<p:id>15</p:id>
			<p:enabled>true</p:enabled>
			<p:entity>SetCircuitsOffCommand</p:entity>
		</p:subscriptor>
		<p:subscriptor>
			<p:id>16</p:id>
			<p:enabled>true</p:enabled>
			<p:entity>SetCircuitsOnCommand</p:entity>
		</p:subscriptor>
		<p:subscriptor>
			<p:id>17</p:id>
			<p:enabled>true</p:enabled>
			<p:entity>SetDaliIlluminationRegimeCommand</p:entity>
		</p:subscriptor>
		<p:subscriptor>
			<p:id>18</p:id>
			<p:enabled>true</p:enabled>
			<p:entity>SetFansResetTotalHoursCommand</p:entity>
		</p:subscriptor>
	</p:subscriptors>
	<p:executors>
		<p:executor>
			<p:id>1</p:id>
			<p:enabled>true</p:enabled>
			<p:merge_wait_time>1</p:merge_wait_time>
			<p:manager_class>com.revenga.rits.back.virtual.equipment.manager.tunnel.ventilation.TunnelVentilationSystemExecutor</p:manager_class>
			<p:subscriptors_ref>
				<p:subscriptor_id_ref>1</p:subscriptor_id_ref>
				<p:subscriptor_id_ref>2</p:subscriptor_id_ref>
				<p:subscriptor_id_ref>3</p:subscriptor_id_ref>
				<p:subscriptor_id_ref>4</p:subscriptor_id_ref>
				<p:subscriptor_id_ref>5</p:subscriptor_id_ref>
				<p:subscriptor_id_ref>6</p:subscriptor_id_ref>
				<p:subscriptor_id_ref>7</p:subscriptor_id_ref>
				<p:subscriptor_id_ref>8</p:subscriptor_id_ref>
				<p:subscriptor_id_ref>9</p:subscriptor_id_ref>
				<p:subscriptor_id_ref>18</p:subscriptor_id_ref>
			</p:subscriptors_ref>
		</p:executor>
		<p:executor>
			<p:id>2</p:id>
			<p:enabled>true</p:enabled>
			<p:merge_wait_time>1</p:merge_wait_time>
			<p:manager_class>com.revenga.rits.back.virtual.equipment.manager.tunnel.illumination.TunnelIlluminationSystemExecutor</p:manager_class>
			<p:subscriptors_ref>
				<p:subscriptor_id_ref>10</p:subscriptor_id_ref>
				<p:subscriptor_id_ref>11</p:subscriptor_id_ref>
				<p:subscriptor_id_ref>12</p:subscriptor_id_ref>
				<p:subscriptor_id_ref>13</p:subscriptor_id_ref>
				<p:subscriptor_id_ref>14</p:subscriptor_id_ref>
				<p:subscriptor_id_ref>15</p:subscriptor_id_ref>
				<p:subscriptor_id_ref>16</p:subscriptor_id_ref>
				<p:subscriptor_id_ref>17</p:subscriptor_id_ref>
			</p:subscriptors_ref>
		</p:executor>
	</p:executors>
</p:manager_adapter_v1>
