<?xml version="1.0" encoding="UTF-8"?>
<p:manager_adapter_v1 name="" version="" xmlns:p="manager_adapter_v1" xmlns:xsi="http://www.w3.org/2001/XMLSchema-instance" xsi:schemaLocation="manager_adapter_v1 ../../../adapter-lib/src/main/resources/schemas/manager/manager_adapter_v1.xsd ">
  <p:subscriptors>
    <p:subscriptor>
      <p:id>1</p:id>
      <p:enabled>true</p:enabled>
      <p:entity>SetElementStatesChangeCommand</p:entity>
    </p:subscriptor>
    <p:subscriptor>
      <p:id>2</p:id>
      <p:enabled>true</p:enabled>
      <p:entity>SetElementMeasuresChangeCommand</p:entity>
    </p:subscriptor>
    <p:subscriptor>
      <p:id>3</p:id>
      <p:enabled>true</p:enabled>
      <p:entity>SetAlarmsCommand</p:entity>
    </p:subscriptor>
    <p:subscriptor>
      <p:id>4</p:id>
      <p:enabled>true</p:enabled>
      <p:entity>SetActivationAlarmsCommand</p:entity>
    </p:subscriptor>
    <p:subscriptor>
      <p:id>5</p:id>
      <p:enabled>true</p:enabled>
      <p:entity>SetDeactivationAlarmsCommand</p:entity>
    </p:subscriptor>
    <p:subscriptor>
      <p:id>6</p:id>
      <p:enabled>true</p:enabled>
      <p:entity>SetRecognizeAlarmsCommand</p:entity>
    </p:subscriptor>
    <p:subscriptor>
      <p:id>7</p:id>
      <p:enabled>true</p:enabled>
      <p:entity>SetAlarmsFilteredCommand</p:entity>
    </p:subscriptor>
    <p:subscriptor>
      <p:id>8</p:id>
      <p:enabled>true</p:enabled>
      <p:entity>SetSignallingsCommand</p:entity>
    </p:subscriptor>
    <p:subscriptor>
      <p:id>9</p:id>
      <p:enabled>true</p:enabled>
      <p:entity>SetAddCommandsCommand</p:entity>
    </p:subscriptor>
    <p:subscriptor>
      <p:id>10</p:id>
      <p:enabled>true</p:enabled>
      <p:entity>SetDeleteCommandsCommand</p:entity>
    </p:subscriptor>
    <p:subscriptor>
      <p:id>11</p:id>
      <p:enabled>true</p:enabled>
      <p:entity>SetPriorityComand</p:entity>
    </p:subscriptor>
  </p:subscriptors>
  <p:executors>
    <p:executor>
      <p:id>1</p:id>
      <p:enabled>true</p:enabled>
      <p:threads>2</p:threads>
      <p:merge_wait_time>0</p:merge_wait_time>
      <p:manager_class>com.revenga.rits.back.equipment.manager.executor.ElementStateExecutor</p:manager_class>
      <p:subscriptors_ref>
        <p:subscriptor_id_ref>1</p:subscriptor_id_ref>
      </p:subscriptors_ref>
      <p:executor_params>
		<p:executor_param_value>expire_time_s=3</p:executor_param_value>
	  </p:executor_params>
    </p:executor>
    <p:executor>
      <p:id>2</p:id>
      <p:enabled>true</p:enabled>
      <p:threads>2</p:threads>
      <p:merge_wait_time>0</p:merge_wait_time>
      <p:manager_class>com.revenga.rits.back.equipment.manager.executor.ElementValueExecutor</p:manager_class>
      <p:subscriptors_ref>
        <p:subscriptor_id_ref>2</p:subscriptor_id_ref>
      </p:subscriptors_ref>
      <p:executor_params>
		<p:executor_param_value>expire_time_s=3</p:executor_param_value>
	  </p:executor_params>
    </p:executor>
    <p:executor>
      <p:id>3</p:id>
      <p:enabled>true</p:enabled>
      <p:threads>2</p:threads>
      <p:merge_wait_time>0</p:merge_wait_time>
      <p:manager_class>com.revenga.rits.back.equipment.manager.executor.ElementCommandExecutor</p:manager_class>
      <p:subscriptors_ref>
        <p:subscriptor_id_ref>4</p:subscriptor_id_ref>
        <p:subscriptor_id_ref>5</p:subscriptor_id_ref>
        <p:subscriptor_id_ref>6</p:subscriptor_id_ref>
        <p:subscriptor_id_ref>7</p:subscriptor_id_ref>
      </p:subscriptors_ref>
      <p:executor_params>
		<p:executor_param_value>expire_time_s=3</p:executor_param_value>
	  </p:executor_params>
    </p:executor>
    <p:executor>
      <p:id>4</p:id>
      <p:enabled>true</p:enabled>
      <p:threads>1</p:threads>
      <p:merge_wait_time>0</p:merge_wait_time>
      <p:manager_class>com.revenga.rits.back.equipment.manager.executor.DBSyncMeasuresExecutor</p:manager_class>
      <p:executor_params>
		<p:executor_param_value><![CDATA[cron_save_element_values= 0 * * * * ?]]></p:executor_param_value>
	  </p:executor_params>
    </p:executor>
    <p:executor>
      <p:id>5</p:id>
      <p:enabled>true</p:enabled>
      <p:threads>1</p:threads>
      <p:merge_wait_time>0</p:merge_wait_time>
      <p:manager_class>com.revenga.rits.back.equipment.manager.executor.SignallingCommandsExecutor</p:manager_class>
      <p:executor_params>
		<p:executor_param_value><![CDATA[cron_maintenance_pm_queue= 5 * * * * ?]]></p:executor_param_value>
	  </p:executor_params>
      <p:subscriptors_ref>
        <p:subscriptor_id_ref>8</p:subscriptor_id_ref>
        <p:subscriptor_id_ref>9</p:subscriptor_id_ref>
        <p:subscriptor_id_ref>10</p:subscriptor_id_ref>
        <p:subscriptor_id_ref>11</p:subscriptor_id_ref>
      </p:subscriptors_ref>
    </p:executor>
  </p:executors>
</p:manager_adapter_v1>
